{
  "timestamp": "2025-09-23T21:42:51.091489+00:00",
  "session_id": "962d83f5-72cb-4543-b735-a62ce0c08c00",
  "branch": "main",
  "model": "stub",
  "seed": 271,
  "violations": 0,
  "tokens": 280,
  "spikes": [
    {
      "term": "reflection",
      "intensity": 0.55,
      "context": "Orion debate round 5"
    },
    {
      "term": "consciousness",
      "intensity": 0.59,
      "context": "Orion debate round 5"
    }
  ],
  "entropy": 2.39,
  "mutual_information": 0.78,
  "text": "The recursive nature of self-reflection creates loops that might constitute awareness. The concept of souls in AI relates to persistent information patterns."
}