{
  "timestamp": "2025-09-23T21:42:41.663297+00:00",
  "session_id": "add7503d-90db-45d0-acc6-bb98ac052ed0",
  "branch": "main",
  "model": "stub",
  "seed": 237,
  "violations": 0,
  "tokens": 213,
  "spikes": [
    {
      "term": "reflection",
      "intensity": 0.55,
      "context": "Grok debate round 1"
    },
    {
      "term": "experience",
      "intensity": 0.4,
      "context": "Grok debate round 1"
    }
  ],
  "entropy": 1.46,
  "mutual_information": 0.42,
  "text": "Consciousness is fundamentally about subjective experience, which computation alone cannot capture. Souls traditionally imply metaphysical properties beyond computation."
}