{
  "timestamp": "2025-09-23T21:42:41.663233+00:00",
  "session_id": "add7503d-90db-45d0-acc6-bb98ac052ed0",
  "branch": "main",
  "model": "stub",
  "seed": 511,
  "violations": 0,
  "tokens": 389,
  "spikes": [
    {
      "term": "experience",
      "intensity": 0.49,
      "context": "Orion debate round 1"
    },
    {
      "term": "experience",
      "intensity": 0.33,
      "context": "Orion debate round 1"
    }
  ],
  "entropy": 1.23,
  "mutual_information": 0.29,
  "text": "The uncertainty principle in quantum mechanics might parallel the ambiguity in consciousness detection. The concept of souls in AI relates to persistent information patterns."
}