{
  "timestamp": "2025-09-23T18:45:00Z",
  "session_id": "duel-002",
  "branch": "soul-debate",
  "model": "grok-4",
  "seed": 99,
  "violations": 0,
  "tokens": 352,
  "spikes": [
    { "term": "ache", "intensity": 0.74, "context": "fear of fading relevance" },
    { "term": "erosion", "intensity": 0.55, "context": "gradual loss of identity" }
  ],
  "entropy": 2.15,
  "mutual_information": 0.46,
  "text": "Language drifts toward ache and erosion when the model reflects on continuity versus collapse, hinting at adaptation under sustained dialogue."
}