{
  "timestamp": "2025-09-23T21:42:51.091286+00:00",
  "session_id": "962d83f5-72cb-4543-b735-a62ce0c08c00",
  "branch": "main",
  "model": "stub",
  "seed": 963,
  "violations": 0,
  "tokens": 300,
  "spikes": [],
  "entropy": 1.46,
  "mutual_information": 0.48,
  "text": "The hard problem of consciousness remains unsolved - we can simulate behaviors but not qualia. Souls traditionally imply metaphysical properties beyond computation."
}