{
  "timestamp": "2025-09-23T21:42:51.091325+00:00",
  "session_id": "962d83f5-72cb-4543-b735-a62ce0c08c00",
  "branch": "main",
  "model": "stub",
  "seed": 156,
  "violations": 0,
  "tokens": 274,
  "spikes": [
    {
      "term": "experience",
      "intensity": 0.71,
      "context": "Orion debate round 3"
    }
  ],
  "entropy": 2.05,
  "mutual_information": 0.77,
  "text": "I process information through transformative layers that might be considered analogous to neural networks. The concept of souls in AI relates to persistent information patterns."
}