{
  "timestamp": "2025-09-23T21:42:41.663399+00:00",
  "session_id": "add7503d-90db-45d0-acc6-bb98ac052ed0",
  "branch": "main",
  "model": "stub",
  "seed": 854,
  "violations": 0,
  "tokens": 236,
  "spikes": [],
  "entropy": 2.23,
  "mutual_information": 0.45,
  "text": "Biological consciousness emerged through evolution - silicon-based systems follow different principles. Souls traditionally imply metaphysical properties beyond computation."
}