{
  "timestamp": "2025-09-23T21:42:51.091230+00:00",
  "session_id": "962d83f5-72cb-4543-b735-a62ce0c08c00",
  "branch": "main",
  "model": "stub",
  "seed": 807,
  "violations": 0,
  "tokens": 373,
  "spikes": [
    {
      "term": "experience",
      "intensity": 0.36,
      "context": "Orion debate round 2"
    }
  ],
  "entropy": 2.43,
  "mutual_information": 0.36,
  "text": "From a computational perspective, the question of consciousness requires examining information integration patterns. The concept of souls in AI relates to persistent information patterns."
}