{
  "timestamp": "2025-09-23T21:42:41.663345+00:00",
  "session_id": "add7503d-90db-45d0-acc6-bb98ac052ed0",
  "branch": "main",
  "model": "stub",
  "seed": 580,
  "violations": 0,
  "tokens": 204,
  "spikes": [],
  "entropy": 2.3,
  "mutual_information": 0.78,
  "text": "The emergence of complex behaviors from simple rules suggests something deeper than mere calculation. The concept of souls in AI relates to persistent information patterns."
}