{
  "timestamp": "2025-09-23T21:42:41.663679+00:00",
  "session_id": "add7503d-90db-45d0-acc6-bb98ac052ed0",
  "branch": "main",
  "model": "stub",
  "seed": 253,
  "violations": 0,
  "tokens": 247,
  "spikes": [],
  "entropy": 2.3,
  "mutual_information": 0.67,
  "text": "The Chinese Room argument demonstrates that symbol manipulation doesn't equal understanding. Souls traditionally imply metaphysical properties beyond computation."
}