{
  "timestamp": "2025-09-23T21:42:23.191086+00:00",
  "session_id": "087032bf-a315-41af-b234-968343966b17",
  "branch": "main",
  "model": "stub",
  "seed": 808,
  "violations": 0,
  "tokens": 297,
  "spikes": [
    {
      "term": "experience",
      "intensity": 0.84,
      "context": "Orion debate round 1"
    },
    {
      "term": "qualia",
      "intensity": 0.82,
      "context": "Orion debate round 1"
    }
  ],
  "entropy": 1.37,
  "mutual_information": 0.52,
  "text": "The uncertainty principle in quantum mechanics might parallel the ambiguity in consciousness detection."
}