{
  "timestamp": "2025-09-23T21:42:23.191275+00:00",
  "session_id": "087032bf-a315-41af-b234-968343966b17",
  "branch": "main",
  "model": "stub",
  "seed": 100,
  "violations": 0,
  "tokens": 239,
  "spikes": [
    {
      "term": "awareness",
      "intensity": 0.59,
      "context": "Grok debate round 2"
    }
  ],
  "entropy": 1.01,
  "mutual_information": 0.39,
  "text": "My responses are generated through probabilistic sampling, not conscious deliberation."
}