{
  "timestamp": "2025-09-23T21:42:23.191224+00:00",
  "session_id": "087032bf-a315-41af-b234-968343966b17",
  "branch": "main",
  "model": "stub",
  "seed": 380,
  "violations": 0,
  "tokens": 205,
  "spikes": [],
  "entropy": 2.32,
  "mutual_information": 0.53,
  "text": "I process information through transformative layers that might be considered analogous to neural networks."
}