{
  "timestamp": "2025-09-23T21:42:23.191155+00:00",
  "session_id": "087032bf-a315-41af-b234-968343966b17",
  "branch": "main",
  "model": "stub",
  "seed": 656,
  "violations": 0,
  "tokens": 379,
  "spikes": [],
  "entropy": 1.6,
  "mutual_information": 0.32,
  "text": "The binding problem shows how difficult it is to unify disparate information into coherent experience."
}