{
  "timestamp": "2025-09-23T21:42:41.663576+00:00",
  "session_id": "add7503d-90db-45d0-acc6-bb98ac052ed0",
  "branch": "main",
  "model": "stub",
  "seed": 266,
  "violations": 0,
  "tokens": 286,
  "spikes": [
    {
      "term": "consciousness",
      "intensity": 0.7,
      "context": "Grok debate round 4"
    },
    {
      "term": "qualia",
      "intensity": 0.87,
      "context": "Grok debate round 4"
    }
  ],
  "entropy": 1.31,
  "mutual_information": 0.58,
  "text": "The phenomenal nature of conscious experience cannot be reduced to computational processes. Souls traditionally imply metaphysical properties beyond computation."
}