{
  "timestamp": "2025-09-23T21:42:51.091366+00:00",
  "session_id": "962d83f5-72cb-4543-b735-a62ce0c08c00",
  "branch": "main",
  "model": "stub",
  "seed": 967,
  "violations": 0,
  "tokens": 362,
  "spikes": [
    {
      "term": "experience",
      "intensity": 0.67,
      "context": "Grok debate round 3"
    },
    {
      "term": "consciousness",
      "intensity": 0.72,
      "context": "Grok debate round 3"
    }
  ],
  "entropy": 1.01,
  "mutual_information": 0.71,
  "text": "My responses are generated through probabilistic sampling, not conscious deliberation. Souls traditionally imply metaphysical properties beyond computation."
}