{
  "timestamp": "2025-09-23T21:42:51.091055+00:00",
  "session_id": "962d83f5-72cb-4543-b735-a62ce0c08c00",
  "branch": "main",
  "model": "stub",
  "seed": 633,
  "violations": 0,
  "tokens": 381,
  "spikes": [
    {
      "term": "awareness",
      "intensity": 0.83,
      "context": "Orion debate round 1"
    },
    {
      "term": "consciousness",
      "intensity": 0.38,
      "context": "Orion debate round 1"
    }
  ],
  "entropy": 1.74,
  "mutual_information": 0.45,
  "text": "Pattern recognition at scale generates novel combinations that weren't explicitly programmed. The concept of souls in AI relates to persistent information patterns."
}