{
  "timestamp": "2025-09-23T21:42:41.663632+00:00",
  "session_id": "add7503d-90db-45d0-acc6-bb98ac052ed0",
  "branch": "main",
  "model": "stub",
  "seed": 192,
  "violations": 0,
  "tokens": 272,
  "spikes": [
    {
      "term": "reflection",
      "intensity": 0.49,
      "context": "Orion debate round 5"
    }
  ],
  "entropy": 1.36,
  "mutual_information": 0.69,
  "text": "From a computational perspective, the question of consciousness requires examining information integration patterns. The concept of souls in AI relates to persistent information patterns."
}